"AUD_FECHA_CREACION","AUD_USUARIO_CREACION","AUD_FECHA_ACTUALIZACION","AUD_USUARIO_ACTUALIZACION","AUD_FECHA_ELIMINACION","AUD_USUARIO_ELIMINACION","AUD_HABILITADO","AUD_ESTADO","ID","OTRAPARROQUIARESIDENCIA","PESO","ALTURA","FECHA_NACIMIENTO","EDAD","LACTANDO","TITULO_NOTIFICADOR","ORGANIZACION_NOTIFICADOR","ORGANIZACION_UNIT_CODIGO","ORGANIZACION_UNIT","NOMBRE_NOTIFICADOR","IDENTIFICACION_NOTIFICADOR","OTRA_PARROQUIA_NOTIFICADOR","COMENTARIO_NOTIFICADOR","CASO_NARRATIVO","TITULO_REPORTE","TIPO_REPORTE","MEDIO_NOTIFICACION","TIPO_EMISOR","ORGANIZACION_EMISOR","DELEGADO_ORGANIZACION","NOMBRE_EMISOR","ULTIMA_EDICION_REGISTRADA","FECHA_NOTIFICACION","FECHA_REPORTE_NACIONAL","FECHA_LLENADO_FICHA","FECHA_ATENCION","ANTECEDENTE_EVENTO_PREVIO","ANTECEDENTE_VACUNAL","UNICO_CODIGO_UNIDAD_SALUD","MONITOREO_ESTABLECIMIENTO_SALUD","CODIGO_DHIS2_EVENTO","CODIGO_VIGIFLOW","TIPO_NOTIFICACION","PACIENTE_ID","CTPROVINCIARESIDENCIA_ID","CTCANTORESIDENCIA_ID","CTPARROQUIARESIDENCIA_ID","CTUNIDADEDAD_ID","CTGRUPOETARIO_ID","CTPROFESIONNOTIFICADOR_ID","CT_PROVINCIA_NOTIFICADOR_ID","CT_CANTON_NOTIFICADOR_ID","CT_PARROQUIA_NOTIFICADOR_ID","CT_ESTADO_REGISTRO_ID","AUD_FECHA_CREACION","AUD_USUARIO_CREACION","AUD_FECHA_ACTUALIZACION","AUD_USUARIO_ACTUALIZACION","AUD_FECHA_ELIMINACION","AUD_USUARIO_ELIMINACION","AUD_HABILITADO","AUD_ESTADO","PACIENTE_ID","NOMBRE","IDENTIFICACION","FECHA_NACIMIENTO","REGISTRO_SINCRONIZADO","CODIGO_DHIS2_ENTIDAD","CODIGO_VIGIFLOW","ORIGEN","CT_SEXO_ID","CT_AUTO_IDENTIFICACION_ETNICA_ID","AUD_FECHA_CREACION","AUD_USUARIO_CREACION","AUD_FECHA_ACTUALIZACION","AUD_USUARIO_ACTUALIZACION","AUD_FECHA_ELIMINACION","AUD_USUARIO_ELIMINACION","AUD_HABILITADO","AUD_ESTADO","CATALOGO_ID","DESCRIPCION_VIGIFLOW","DESCRIPCION_DHIS2","DESCRIPCION_HOMOLOGADA","CATALOGO_ID_PADRE","CTTIPOCATALOGO_ID","AUD_FECHA_CREACION","AUD_USUARIO_CREACION","AUD_FECHA_ACTUALIZACION","AUD_USUARIO_ACTUALIZACION","AUD_FECHA_ELIMINACION","AUD_USUARIO_ELIMINACION","AUD_HABILITADO","AUD_ESTADO","ID","TIPO_GRAVEDAD","MUERTE","RIESGO_VIDA","DISCAPACIDAD","HOSPITALIZACION","ANOMALIA_CONGENITA","ABORTO","MUERTE_FETAL","OTROS_EVENTOS_IMPORTANTES","OTROS_EVENTOS_IMPORTANTES_TX","PARTE_EVENTOS_PREOCUPACION","NUEVO_EVENTOS","CONDICION_EGRESO","NOTIFICACION_ID","AUD_FECHA_CREACION","AUD_USUARIO_CREACION","AUD_FECHA_ACTUALIZACION","AUD_USUARIO_ACTUALIZACION","AUD_FECHA_ELIMINACION","AUD_USUARIO_ELIMINACION","AUD_HABILITADO","AUD_ESTADO","DATOS_ESAVI_ID","SISTEMA_DE_CODIFICACION","NOMBRE_ESAVI","DESCRIPCION","NOMBRE_ESAVI_REPORTADO","CT_LLT_MEDDRA_ID","CODIGO_LLT","NAME_LLT","CT_PT_MEDDRA_ID","CODIGO_PT","NAME_PT","CODIGO_HLT","NAME_HLT","CODIGO_HLGT","NAME_HLGT","CT_HLT_MEDDRA_ID","CT_HLGT_MEDDRA_ID","CT_SOC_MEDDRA_ID","CODIGO_SOC","NAME_SOC","CODIGO_ESAVI_CIE10","FECHA_ESAVI","FECHA_FINALIZACION","DURACION_EVENTO","RESULTADO_EVENTO","COGIDOCASO","NOTIFICACION_ID"
2025-10-27 14:47:59.846 -0500,SYSTEM,,,,,true,true,"838c17eb-4ff3-4561-9eb5-5e73285f5e66",,,,,27,false,,,,,,,,,"This spontaneous report was received from a physician and refers to a 27-year-old female patient. 

The patient's medical history, concurrent conditions, and concomitant therapies were not reported. 

On 13-JUN-2025, the patient was vaccinated with the first dose of Human Papillomavirus 9-valent Vaccine, Recombinant (GARDASIL 9) SYRINGE with lot # Y009172 which has been verified to be valid; expiration date was not provided but upon internal validation established as 13-Nov-2026; (strength, dose, frequency, route of administration and site of administration were not provided) as prophylaxis.

On an unspecified date in 2025, the patient experienced the appearance of an acne outbreak, a condition that had not previously occurred, and had decided to not continue with the second dose scheduled on 13-AUG-2025. At the reporting time, the outcome of acne was not provided.

The causal relationship between the event of acne and Human Papillomavirus 9-valent Vaccine, Recombinant (GARDASIL 9) was not reported.

This is one of two reports from the same reporter.",,Espontáneo,,,,ARCSA,,Fanny Serafin Bernabe,2025-08-04 00:00:00.000,,,,,,,,,EC-009507513-2314979,vigiflow,b77e7037-ad19-43e7-8130-c44eb001d57e,,,,"8fb4e200-9185-4787-98c3-c092acd5f209",b1ad435d-2920-4ce4-8e7d-ed1585dbab3b,eb61c52e-fbe9-4eb0-a740-f8fc15fe4315,,,,,2025-10-27 14:47:59.496 -0500,SYSTEM,,,,,true,true,b77e7037-ad19-43e7-8130-c44eb001d57e,,,,false,,EC-009507513-2314979,vigiflow,"2076a932-c200-406b-96a4-2c370016e573",,2025-10-23 18:29:45.796 -0500,System,,"",,"",true,true,"2076a932-c200-406b-96a4-2c370016e573",Femenino,Mujer,Femenino,,"305bd079-29b9-413f-a596-63ff78c7f05b",2025-10-27 14:48:00.110 -0500,SYSTEM,,,,,true,true,"57f771d9-d429-40fe-8a8e-16328d2d05be",NO GRAVE,,,,,,,,,,,,,"838c17eb-4ff3-4561-9eb5-5e73285f5e66",2025-10-27 14:48:24.895 -0500,,,,,,true,true,"8901beb6-a776-42a9-9678-0dca1ed68b65",,ACNÉ,,"EL DÍA 28/07/2025 INFORMÓ, VÍA MENSAJE DE WHATSAPP, LA APARICIÓN DE UN BROTE ACNEICO.",,,ACNÉ,,,ACNÉ,,ACNÉS,,ENFERMEDADES DE LOS ANEJOS DE LA PIEL,,,23,"10040785",TRASTORNOS DE LA PIEL Y DEL TEJIDO SUBCUTÁNEO,,2025-01-01 00:00:00.000,,"",Desconocido,EC-009507513-2314979,"838c17eb-4ff3-4561-9eb5-5e73285f5e66"
2025-10-27 14:47:59.847 -0500,SYSTEM,,,,,true,true,"14ee6976-d9bf-4778-b942-0ff98d76848e",,,,,41,false,,,,,,,,,"This spontaneous report was received from a physician, concerning to a 41-year-old female patient. 

The patient's medical history was not reported. The patient's concurrent conditions were not reported. Concomitant therapies were not reported. 

On 06-May-2025, the patient started therapy with Human Papillomavirus 9-valent Vaccine, Recombinant (lot #Y009172 has been verified to be valid, expiration date confirmed as 13-Nov-2025). On 09-Jul-2025, the patient started therapy with Human Papillomavirus 9-valent Vaccine, Recombinant (lot #Y009172 has been verified to be valid, expiration date confirmed as 13-Nov-2026). Both as prophylaxis.

On 2025, the patient reported a recent acne outbreak, with no previous similar history; on a visit on 28-Jun-2025 (Acne). She refused to apply the third dose. The outcome for the event was not provided.

The causal relationship between the event and Human Papillomavirus 9-valent Vaccine, Recombinant was not provided.",,Espontáneo,,,,ARCSA,,Lipsi Merchán Aguas,2025-08-04 00:00:00.000,,,,,,,,,EC-009507513-2315098,vigiflow,bb5bd434-6d0b-4bd3-bb3b-fec7f0b2e086,,,,"8fb4e200-9185-4787-98c3-c092acd5f209",b1ad435d-2920-4ce4-8e7d-ed1585dbab3b,eb61c52e-fbe9-4eb0-a740-f8fc15fe4315,,,,,2025-10-27 14:47:59.500 -0500,SYSTEM,,,,,true,true,bb5bd434-6d0b-4bd3-bb3b-fec7f0b2e086,,,,false,,EC-009507513-2315098,vigiflow,"2076a932-c200-406b-96a4-2c370016e573",,2025-10-23 18:29:45.796 -0500,System,,"",,"",true,true,"2076a932-c200-406b-96a4-2c370016e573",Femenino,Mujer,Femenino,,"305bd079-29b9-413f-a596-63ff78c7f05b",2025-10-27 14:48:00.122 -0500,SYSTEM,,,,,true,true,"4268daba-47cc-4e36-bcc9-0527b0eba42f",NO GRAVE,,,,,,,,,,,,,"14ee6976-d9bf-4778-b942-0ff98d76848e",2025-10-27 14:48:24.961 -0500,,,,,,true,true,"629bf6a5-cb9e-498c-8f15-7777a837dd74",,ACNÉ,,"EL 28/07/2025, DURANTE UNA VISITA PRESENCIAL, NOTIFICÓ UN BROTE ACNEICO RECIENTE.",,,ACNÉ,,,ACNÉ,,ACNÉS,,ENFERMEDADES DE LOS ANEJOS DE LA PIEL,,,23,"10040785",TRASTORNOS DE LA PIEL Y DEL TEJIDO SUBCUTÁNEO,,2025-01-01 00:00:00.000,,"",Desconocido,EC-009507513-2315098,"14ee6976-d9bf-4778-b942-0ff98d76848e"
2025-10-27 14:47:59.979 -0500,SYSTEM,,,,,true,true,eafed97f-b730-4c4e-a9a7-93270a723b1e,,,,2005-10-02 00:00:00.000,19,false,,CENTRO SALUD AMBUQUI,,,JEAN  GARRIDO,,,,"Narrativa del caso:
PACIENTE GESTANTE REFIERE QUE 7 DIAS POSTERIORES A LA COLACION DE LA VACUNA PRESENTA ABCESO EN EL SITIO DE PUNCION. NO REFIERE SINTOMATOLOGIA ACOMPAÑANTE. NO AUTOMEDICA. 
Describir otra condición médicamente importante:
",,Espontáneo,,,,ARCSA-ZI,,Jessica Karina Pomasqui Benavides,2025-08-04 00:00:00.000,2025-07-30 00:00:00.000,,,,,,,,EC-ARCSA-300070608,vigiflow,"54c2c8ed-99ad-4d46-9770-83ca8cc228f1",,,,"8fb4e200-9185-4787-98c3-c092acd5f209","5d32d25e-ace7-4a34-97b2-c3a422177f3b",eb61c52e-fbe9-4eb0-a740-f8fc15fe4315,,,,,2025-10-27 14:47:59.501 -0500,SYSTEM,,,,,true,true,"54c2c8ed-99ad-4d46-9770-83ca8cc228f1",MRMA,,,false,,EC-ARCSA-300070608,vigiflow,"2076a932-c200-406b-96a4-2c370016e573",,2025-10-23 18:29:45.796 -0500,System,,"",,"",true,true,"2076a932-c200-406b-96a4-2c370016e573",Femenino,Mujer,Femenino,,"305bd079-29b9-413f-a596-63ff78c7f05b",2025-10-27 14:48:00.281 -0500,SYSTEM,,,,,true,true,d010dd07-affb-45cb-ae00-91cef902357f,NO GRAVE,,,,,,,,,,,,,eafed97f-b730-4c4e-a9a7-93270a723b1e,2025-10-27 14:48:25.023 -0500,,,,,,true,true,"99a5b258-79bb-4343-9115-0b40343480d8",,ABSCESO EN LA ZONA DE VACUNACIÓN,,ABSCESO EN LA ZONA DE VACUNACIÓN,,,ABSCESO EN LA ZONA DE VACUNACIÓN,,,ABSCESO EN LA ZONA DE VACUNACIÓN,,INFECCIONES NCOC,,INFECCIONES - SIN ESPECIFICACIÓN DEL GERMEN PATÓGENO,,,11,"10021881",INFECCIONES E INFESTACIONES,,2025-07-01 00:00:00.000,,"",Recuperado/resuelto,EC-ARCSA-300070608,eafed97f-b730-4c4e-a9a7-93270a723b1e
2025-10-27 14:47:59.951 -0500,SYSTEM,,,,,true,true,d40f8396-6989-45c2-a392-524e7c699c8d,,,,1998-05-16 00:00:00.000,27,false,,CENTRO SALUD AMBUQUI,,,JEAN  GARRIDO,,,,"Narrativa del caso:
PACIENTE REFIERE QUE APROXIMADAMENTE 24 HORAS POSTERIORES A LA COLOCACION DE LAS VACUNAS PRESENTA LEVE DOLOR EN SITIO DE PUNCION. NIEGA AUTOMEDICARSE. 
Describir otra condición médicamente importante:
",,Espontáneo,,,,ARCSA-ZI,,Jessica Karina Pomasqui Benavides,2025-08-04 00:00:00.000,2025-07-31 00:00:00.000,,,,,,,,EC-ARCSA-300070609,vigiflow,"3c712990-1163-4941-bd1c-bdc99138ba63",,,,"8fb4e200-9185-4787-98c3-c092acd5f209",b1ad435d-2920-4ce4-8e7d-ed1585dbab3b,eb61c52e-fbe9-4eb0-a740-f8fc15fe4315,,,,,2025-10-27 14:47:59.531 -0500,SYSTEM,,,,,true,true,"3c712990-1163-4941-bd1c-bdc99138ba63",EIAJ,,,false,,EC-ARCSA-300070609,vigiflow,"1af50380-2bd0-48c7-8f95-7a7a6a472e9d",,2025-10-23 18:29:45.796 -0500,System,,"",,"",true,true,"1af50380-2bd0-48c7-8f95-7a7a6a472e9d",Masculino,Hombre,Masculino,,"305bd079-29b9-413f-a596-63ff78c7f05b",2025-10-27 14:48:00.174 -0500,SYSTEM,,,,,true,true,"1bfd5e45-54b6-4b8d-86c2-b54f0609e37d",NO GRAVE,,,,,,,,,,,,,d40f8396-6989-45c2-a392-524e7c699c8d,2025-10-27 14:48:25.104 -0500,,,,,,true,true,f8314cdd-fa8d-4535-80fd-537a61202ac2,,DOLOR EN LA ZONA DE VACUNACIÓN,,DOLOR EN LA ZONA DE VACUNACIÓN,,,DOLOR EN LA ZONA DE VACUNACIÓN,,,DOLOR EN LA ZONA DE VACUNACIÓN,,REACCIONES EN LA ZONA DE VACUNACIÓN,,REACCIONES EN LA ZONA DE ADMINISTRACIÓN,,,,,TRASTORNOS GENERALES Y ALTERACIONES EN EL LUGAR DE ADMINISTRACIÓN,,2025-07-23 00:00:00.000,,"",Recuperado/resuelto,EC-ARCSA-300070609,d40f8396-6989-45c2-a392-524e7c699c8d
2025-10-27 14:47:59.922 -0500,SYSTEM,,,,,true,true,"569a1d75-d667-4e35-91e8-62bdd646aa1a",,,,2025-05-30 00:00:00.000,2,false,,CS. MARIANO ESTRELLA,,,SARA BARROS ,,,,"Narrativa del caso:
MADRE DE NIÑA DE 2 MESES DE EDAD INDICA QUE LUEGO DE LA ADMINISTRACIÓN DE LA VACUNA DE 2 MESES PRESENTA IRRITABILIDAD, MALESTAR  POR LO QUE ACUDE 

",,Espontáneo,,,,ARCSA-Z6,,Luis Guiracocha,2025-08-04 00:00:00.000,2025-08-04 00:00:00.000,,,,,,,,EC-ARCSA-300070613,vigiflow,"4d59093b-e22b-496d-be99-0d373f847d72",c41a07b4-3874-42c1-bd48-905456eb332f,,,d6c1f97e-fecc-49b8-af19-9cb222df2a43,bcb61f33-40de-43c5-836c-54372fd2e5ee,"92622386-38b0-416e-b067-17fe6f6e8ce5",c41a07b4-3874-42c1-bd48-905456eb332f,,,,2025-10-27 14:47:59.501 -0500,SYSTEM,,,,,true,true,"4d59093b-e22b-496d-be99-0d373f847d72",ALAR,,,false,,EC-ARCSA-300070613,vigiflow,"2076a932-c200-406b-96a4-2c370016e573",,2025-10-23 18:29:45.796 -0500,System,,"",,"",true,true,"2076a932-c200-406b-96a4-2c370016e573",Femenino,Mujer,Femenino,,"305bd079-29b9-413f-a596-63ff78c7f05b",2025-10-27 14:48:00.159 -0500,SYSTEM,,,,,true,true,"82ce7a06-8cf9-4fee-b4ee-3d07c18e0ed5",NO GRAVE,,,,,,,,,,,,,"569a1d75-d667-4e35-91e8-62bdd646aa1a",2025-10-27 14:48:25.176 -0500,,,,,,true,true,"0c39dcc1-e407-4b74-b343-62906e246826",,IRRITABILIDAD POSTVACUNAL,,IRRITABILIDAD POSTVACUNAL,22067,"10022999",IRRITABILIDAD POSTVACUNAL,12012,"10057224",IRRITABILIDAD POSTVACUNAL,,SÍNTOMAS Y SIGNOS GENERALES NCOC,,TRASTORNOS SISTÉMICOS GENERALES NCOC,,,,,TRASTORNOS GENERALES Y ALTERACIONES EN EL LUGAR DE ADMINISTRACIÓN,,2025-08-01 00:00:00.000,,"",Recuperando/resolviendo,EC-ARCSA-300070613,"569a1d75-d667-4e35-91e8-62bdd646aa1a"
2025-10-27 14:47:59.922 -0500,SYSTEM,,,,,true,true,"569a1d75-d667-4e35-91e8-62bdd646aa1a",,,,2025-05-30 00:00:00.000,2,false,,CS. MARIANO ESTRELLA,,,SARA BARROS ,,,,"Narrativa del caso:
MADRE DE NIÑA DE 2 MESES DE EDAD INDICA QUE LUEGO DE LA ADMINISTRACIÓN DE LA VACUNA DE 2 MESES PRESENTA IRRITABILIDAD, MALESTAR  POR LO QUE ACUDE 

",,Espontáneo,,,,ARCSA-Z6,,Luis Guiracocha,2025-08-04 00:00:00.000,2025-08-04 00:00:00.000,,,,,,,,EC-ARCSA-300070613,vigiflow,"4d59093b-e22b-496d-be99-0d373f847d72",c41a07b4-3874-42c1-bd48-905456eb332f,,,d6c1f97e-fecc-49b8-af19-9cb222df2a43,bcb61f33-40de-43c5-836c-54372fd2e5ee,"92622386-38b0-416e-b067-17fe6f6e8ce5",c41a07b4-3874-42c1-bd48-905456eb332f,,,,2025-10-27 14:47:59.501 -0500,SYSTEM,,,,,true,true,"4d59093b-e22b-496d-be99-0d373f847d72",ALAR,,,false,,EC-ARCSA-300070613,vigiflow,"2076a932-c200-406b-96a4-2c370016e573",,2025-10-23 18:29:45.796 -0500,System,,"",,"",true,true,"2076a932-c200-406b-96a4-2c370016e573",Femenino,Mujer,Femenino,,"305bd079-29b9-413f-a596-63ff78c7f05b",2025-10-27 14:48:00.159 -0500,SYSTEM,,,,,true,true,"82ce7a06-8cf9-4fee-b4ee-3d07c18e0ed5",NO GRAVE,,,,,,,,,,,,,"569a1d75-d667-4e35-91e8-62bdd646aa1a",2025-10-27 14:48:25.239 -0500,,,,,,true,true,"2967f8d1-c774-4d6c-a2b6-d1e4ddd53613",,MALESTAR,,MALESTAR,24444,"10025482",MALESTAR,5039,"10025482",MALESTAR,,TRASTORNOS ASTÉNICOS,,TRASTORNOS SISTÉMICOS GENERALES NCOC,,,,,TRASTORNOS GENERALES Y ALTERACIONES EN EL LUGAR DE ADMINISTRACIÓN,,2025-08-01 00:00:00.000,,"",Recuperando/resolviendo,EC-ARCSA-300070613,"569a1d75-d667-4e35-91e8-62bdd646aa1a"
2025-10-27 14:47:59.930 -0500,SYSTEM,,,,,true,true,"833adaaa-5bc0-4584-93a3-ccae5bef4e3a",,,,2025-03-07 00:00:00.000,4,false,,NO REFIERE ,,,GINA CECILIA  ORTEGA TORRES,,,,"Narrativa del caso:
MADRE DE PACIENTE REFIERE QUE DESPUÉS DE LA VACUNACIÓN DEL 18 DE JULIO 2025 PRESENTA ALZA TÉRMICA POR LO QUE AUTOMEDICA PARACETAMOL 13 GOTAS POR 3 DÍAS. POR TANTO, 30 MINUTOS ANTES DE TRAERLE A ESTA CASA DE SALUD PRESENTA ALZA TÉRMICA DE 38.5 DONDE LE AUTOMEDICA PARACETAMOL 13 GOTAS. SIN EMBARGO AL NO TENER UNA MEJORÍA PACIENTE PRESENTA CONVULSIÓN POR UN MANEJO NO ADECUADO DE LA FIEBRE.
",,Espontáneo,,,,ARCSA-Z9,,Edwin Geovanny Bayas Guaquipana,2025-08-04 00:00:00.000,2025-08-04 00:00:00.000,,,,,,,,EC-ARCSA-300070614,vigiflow,"03d83b97-8b4d-480f-914b-516996cbbb52",cb726a38-dcc6-43d6-84ab-63bf087ecde5,,,d6c1f97e-fecc-49b8-af19-9cb222df2a43,bcb61f33-40de-43c5-836c-54372fd2e5ee,"9805ee38-7acc-4f43-89fb-3dc87397e976",cb726a38-dcc6-43d6-84ab-63bf087ecde5,,,,2025-10-27 14:47:59.500 -0500,SYSTEM,,,,,true,true,"03d83b97-8b4d-480f-914b-516996cbbb52",TO. CHU. THI. IS,,,false,,EC-ARCSA-300070614,vigiflow,"1af50380-2bd0-48c7-8f95-7a7a6a472e9d",,2025-10-23 18:29:45.796 -0500,System,,"",,"",true,true,"1af50380-2bd0-48c7-8f95-7a7a6a472e9d",Masculino,Hombre,Masculino,,"305bd079-29b9-413f-a596-63ff78c7f05b",2025-10-27 14:48:00.160 -0500,SYSTEM,,,,,true,true,ad67672a-8dce-422e-a0b7-41536a331f27,NO GRAVE,,,,,,,,,,,,,"833adaaa-5bc0-4584-93a3-ccae5bef4e3a",2025-10-27 14:48:25.304 -0500,,,,,,true,true,"243d9b98-7a42-4e66-b91c-31736358c715",,TEMPERATURA ELEVADA,,FIEBRE ≥38°C,19255,"10020083",TEMPERATURA ELEVADA,6836,"10037660",PIREXIA,,TRASTORNOS FEBRILES,,TRASTORNOS DE LA TEMPERATURA CORPORAL,,,,,TRASTORNOS GENERALES Y ALTERACIONES EN EL LUGAR DE ADMINISTRACIÓN,,2025-07-18 00:00:00.000,2025-07-21 00:00:00.000,"3 Día",Recuperado/resuelto,EC-ARCSA-300070614,"833adaaa-5bc0-4584-93a3-ccae5bef4e3a"
2025-10-27 14:47:59.930 -0500,SYSTEM,,,,,true,true,"833adaaa-5bc0-4584-93a3-ccae5bef4e3a",,,,2025-03-07 00:00:00.000,4,false,,NO REFIERE ,,,GINA CECILIA  ORTEGA TORRES,,,,"Narrativa del caso:
MADRE DE PACIENTE REFIERE QUE DESPUÉS DE LA VACUNACIÓN DEL 18 DE JULIO 2025 PRESENTA ALZA TÉRMICA POR LO QUE AUTOMEDICA PARACETAMOL 13 GOTAS POR 3 DÍAS. POR TANTO, 30 MINUTOS ANTES DE TRAERLE A ESTA CASA DE SALUD PRESENTA ALZA TÉRMICA DE 38.5 DONDE LE AUTOMEDICA PARACETAMOL 13 GOTAS. SIN EMBARGO AL NO TENER UNA MEJORÍA PACIENTE PRESENTA CONVULSIÓN POR UN MANEJO NO ADECUADO DE LA FIEBRE.
",,Espontáneo,,,,ARCSA-Z9,,Edwin Geovanny Bayas Guaquipana,2025-08-04 00:00:00.000,2025-08-04 00:00:00.000,,,,,,,,EC-ARCSA-300070614,vigiflow,"03d83b97-8b4d-480f-914b-516996cbbb52",cb726a38-dcc6-43d6-84ab-63bf087ecde5,,,d6c1f97e-fecc-49b8-af19-9cb222df2a43,bcb61f33-40de-43c5-836c-54372fd2e5ee,"9805ee38-7acc-4f43-89fb-3dc87397e976",cb726a38-dcc6-43d6-84ab-63bf087ecde5,,,,2025-10-27 14:47:59.500 -0500,SYSTEM,,,,,true,true,"03d83b97-8b4d-480f-914b-516996cbbb52",TO. CHU. THI. IS,,,false,,EC-ARCSA-300070614,vigiflow,"1af50380-2bd0-48c7-8f95-7a7a6a472e9d",,2025-10-23 18:29:45.796 -0500,System,,"",,"",true,true,"1af50380-2bd0-48c7-8f95-7a7a6a472e9d",Masculino,Hombre,Masculino,,"305bd079-29b9-413f-a596-63ff78c7f05b",2025-10-27 14:48:00.160 -0500,SYSTEM,,,,,true,true,ad67672a-8dce-422e-a0b7-41536a331f27,NO GRAVE,,,,,,,,,,,,,"833adaaa-5bc0-4584-93a3-ccae5bef4e3a",2025-10-27 14:48:25.368 -0500,,,,,,true,true,"2a1030c9-ec5b-4f0a-b6ab-1fe2438e3a62",,CONVULSIÓN FEBRIL,,"DE ACUERDO A LA INVESTIGACIÓN REALIZADA, EN LUGAR DE DESCRIBIR COMO UNA RIGIDEZ GENERALIZADA, LA FIEBRE NO CONTROLADA POR SUBDOSIFICACIÓN DE PARACETAMOL  CONLLEVO A UNA CONVULSIÓN FEBRIL",,,CONVULSIÓN FEBRIL,,,CONVULSIÓN FEBRIL,,CRISIS Y TRASTORNOS CONVULSIVOS NCOC,,CRISIS EPILÉPTICAS (INCL SUBTIPOS),,,17,"10029205",TRASTORNOS DEL SISTEMA NERVIOSO,,2025-07-21 00:00:00.000,2025-07-21 00:00:00.000,"1 Hora",Recuperado/resuelto,EC-ARCSA-300070614,"833adaaa-5bc0-4584-93a3-ccae5bef4e3a"
2025-10-27 14:47:59.842 -0500,SYSTEM,,,,,true,true,"3daeacc0-f8e7-428a-b48c-2fcde881098e",,,,2024-11-11 00:00:00.000,6,false,,,,,BLANCA CECILIA  PABON RIVADENEIRA,,,,"Descripción de lo sucedido:
DESPUES DE LA VACUNACION DESDE LA 6PM LE DIO FIEBRE ALTA, DOLOR DE LA PIERNA DERECHA, 
Describir otra condición médicamente importante:",,Espontáneo,,,,ARCSA,,Luis Guiracocha,2025-08-04 00:00:00.000,,,,,,,,,EC-ARCSA-300070624,vigiflow,a24f7288-4e5c-44ac-93cd-68af574b009f,,,,d6c1f97e-fecc-49b8-af19-9cb222df2a43,bcb61f33-40de-43c5-836c-54372fd2e5ee,"92622386-38b0-416e-b067-17fe6f6e8ce5",,,,,2025-10-27 14:47:59.532 -0500,SYSTEM,,,,,true,true,a24f7288-4e5c-44ac-93cd-68af574b009f,PENTAVALENTE,,,false,,EC-ARCSA-300070624,vigiflow,"2076a932-c200-406b-96a4-2c370016e573",,2025-10-23 18:29:45.796 -0500,System,,"",,"",true,true,"2076a932-c200-406b-96a4-2c370016e573",Femenino,Mujer,Femenino,,"305bd079-29b9-413f-a596-63ff78c7f05b",2025-10-27 14:48:00.112 -0500,SYSTEM,,,,,true,true,"564d0ee5-b0c5-44e2-a7a9-d41f9d582772",NO GRAVE,,,,,,,,,,,,,"3daeacc0-f8e7-428a-b48c-2fcde881098e",2025-10-27 14:48:25.435 -0500,,,,,,true,true,"04ae8bac-4968-4e76-9d4d-ffcb6325b3a6",,FIEBRE,,FIEBRE-DOLOR,15910,"10016558",FIEBRE,6836,"10037660",PIREXIA,,TRASTORNOS FEBRILES,,TRASTORNOS DE LA TEMPERATURA CORPORAL,,,,,TRASTORNOS GENERALES Y ALTERACIONES EN EL LUGAR DE ADMINISTRACIÓN,,2024-07-12 00:00:00.000,2024-07-13 00:00:00.000,"2 Día",Recuperado/resuelto,EC-ARCSA-300070624,"3daeacc0-f8e7-428a-b48c-2fcde881098e"
2025-10-27 14:47:59.933 -0500,SYSTEM,,,,,true,true,d4ff2df9-772f-4ec1-851d-9859ec37b11d,,,,,18,false,,CENTRO DE SALUD MARIANO ESTRELLA,,,PEDRO MUÑOZ ORDOÑEZ,,,,"Narrativa del caso:
MADRE DE NIÑA DE 1 AÑO 6 MESES DE EDAD, INDICA QUE 2 HORAS POSTERIOR DE LA ADMINISTRACIÓN DE LA VACUNA, PACIENTE PRESENTA IRRITABILIDAD,  ALZA TÉRMICA NO CUANTIFICADA, POR LO QUE ACUDE A ESTA CASA DE SALUD

",,Espontáneo,,,,ARCSA-Z6,,Luis Guiracocha,2025-08-04 00:00:00.000,2025-08-04 00:00:00.000,,,,,,,,EC-ARCSA-300070635,vigiflow,aa2a5f33-7952-4a26-8833-f6e23a9e9a76,c41a07b4-3874-42c1-bd48-905456eb332f,,,d6c1f97e-fecc-49b8-af19-9cb222df2a43,bcb61f33-40de-43c5-836c-54372fd2e5ee,eb61c52e-fbe9-4eb0-a740-f8fc15fe4315,c41a07b4-3874-42c1-bd48-905456eb332f,,,,2025-10-27 14:47:59.533 -0500,SYSTEM,,,,,true,true,aa2a5f33-7952-4a26-8833-f6e23a9e9a76,PIAM,,,false,,EC-ARCSA-300070635,vigiflow,"2076a932-c200-406b-96a4-2c370016e573",,2025-10-23 18:29:45.796 -0500,System,,"",,"",true,true,"2076a932-c200-406b-96a4-2c370016e573",Femenino,Mujer,Femenino,,"305bd079-29b9-413f-a596-63ff78c7f05b",2025-10-27 14:48:00.164 -0500,SYSTEM,,,,,true,true,"378de154-bf59-46d8-b60d-746f36f10b6b",NO GRAVE,,,,,,,,,,,,,d4ff2df9-772f-4ec1-851d-9859ec37b11d,2025-10-27 14:48:25.496 -0500,,,,,,true,true,baab0405-0c0c-4001-84aa-80bcc97ff0b3,,FIEBRE LIGERA,,FIEBRE LIGERA,39266,"10041021",FIEBRE LIGERA,6836,"10037660",PIREXIA,,TRASTORNOS FEBRILES,,TRASTORNOS DE LA TEMPERATURA CORPORAL,,,,,TRASTORNOS GENERALES Y ALTERACIONES EN EL LUGAR DE ADMINISTRACIÓN,,2025-08-04 00:00:00.000,,"",Recuperando/resolviendo,EC-ARCSA-300070635,d4ff2df9-772f-4ec1-851d-9859ec37b11d
2025-10-27 14:47:59.933 -0500,SYSTEM,,,,,true,true,d4ff2df9-772f-4ec1-851d-9859ec37b11d,,,,,18,false,,CENTRO DE SALUD MARIANO ESTRELLA,,,PEDRO MUÑOZ ORDOÑEZ,,,,"Narrativa del caso:
MADRE DE NIÑA DE 1 AÑO 6 MESES DE EDAD, INDICA QUE 2 HORAS POSTERIOR DE LA ADMINISTRACIÓN DE LA VACUNA, PACIENTE PRESENTA IRRITABILIDAD,  ALZA TÉRMICA NO CUANTIFICADA, POR LO QUE ACUDE A ESTA CASA DE SALUD

",,Espontáneo,,,,ARCSA-Z6,,Luis Guiracocha,2025-08-04 00:00:00.000,2025-08-04 00:00:00.000,,,,,,,,EC-ARCSA-300070635,vigiflow,aa2a5f33-7952-4a26-8833-f6e23a9e9a76,c41a07b4-3874-42c1-bd48-905456eb332f,,,d6c1f97e-fecc-49b8-af19-9cb222df2a43,bcb61f33-40de-43c5-836c-54372fd2e5ee,eb61c52e-fbe9-4eb0-a740-f8fc15fe4315,c41a07b4-3874-42c1-bd48-905456eb332f,,,,2025-10-27 14:47:59.533 -0500,SYSTEM,,,,,true,true,aa2a5f33-7952-4a26-8833-f6e23a9e9a76,PIAM,,,false,,EC-ARCSA-300070635,vigiflow,"2076a932-c200-406b-96a4-2c370016e573",,2025-10-23 18:29:45.796 -0500,System,,"",,"",true,true,"2076a932-c200-406b-96a4-2c370016e573",Femenino,Mujer,Femenino,,"305bd079-29b9-413f-a596-63ff78c7f05b",2025-10-27 14:48:00.164 -0500,SYSTEM,,,,,true,true,"378de154-bf59-46d8-b60d-746f36f10b6b",NO GRAVE,,,,,,,,,,,,,d4ff2df9-772f-4ec1-851d-9859ec37b11d,2025-10-27 14:48:25.559 -0500,,,,,,true,true,"686ef9f2-484b-453e-9fa1-db1fc33e861f",,IRRITABILIDAD,,IRRITABILIDAD,22066,"10022998",IRRITABILIDAD,4616,"10022998",IRRITABILIDAD,,ALTERACIONES EMOCIONALES Y DEL ESTADO DE ÁNIMO NCOC,,TRASTORNOS Y ALTERACIONES DEL ESTADO DE ÁNIMO NCOC,,,19,"10037175",TRASTORNOS PSIQUIÁTRICOS,,2025-08-04 00:00:00.000,,"",Recuperando/resolviendo,EC-ARCSA-300070635,d4ff2df9-772f-4ec1-851d-9859ec37b11d
2025-10-27 14:47:59.950 -0500,SYSTEM,,,,,true,true,"90a2fd7a-3ee5-4f00-b83d-e1ffb99c127d",,,,2023-09-13 00:00:00.000,23,false,,CENTRO DE SALUD ARCHIDONA,,,MARTHA GUERRERO,,,"CASO VALIDADO POR LA UZFV
CASO PARA SER EVALUADO POR LA COMISIÓN NACIONAL DE ESAVI GRAVE","Paciente que aparentemente a las 24 horas posterior a la administracion de OPV presenta un exantema maculo papular pluriginoso generalizado mas fiebre 
Describir otra condición médicamente importante:Paciente al momento estable  con los Diagnosticos
-Infeccion viral no especificada caracterizada por lesiones de piel y mucosas
-Otras complicacciones consecutivas a inmunizacion, no especificada en otra parte del cuerpo
-Mononucleosis infecciosa no especificada 
",,Espontáneo,,,,Hospital José María Velasco Ibarra,,HENRRY FERNANDO CABRERA JAPON,2025-08-04 00:00:00.000,2025-08-02 00:00:00.000,,,,,,,,EC-ARCSA-300070637,vigiflow,"1d9c9787-633f-4ee9-80ae-897030e6f2f9",,,,d6c1f97e-fecc-49b8-af19-9cb222df2a43,bcb61f33-40de-43c5-836c-54372fd2e5ee,eb61c52e-fbe9-4eb0-a740-f8fc15fe4315,,,,,2025-10-27 14:47:59.533 -0500,SYSTEM,,,,,true,true,"1d9c9787-633f-4ee9-80ae-897030e6f2f9",ARCHNOFA,"1550519993",,false,,EC-ARCSA-300070637,vigiflow,"1af50380-2bd0-48c7-8f95-7a7a6a472e9d",,2025-10-23 18:29:45.796 -0500,System,,"",,"",true,true,"1af50380-2bd0-48c7-8f95-7a7a6a472e9d",Masculino,Hombre,Masculino,,"305bd079-29b9-413f-a596-63ff78c7f05b",2025-10-27 14:48:00.170 -0500,SYSTEM,,,,,true,true,faf9c131-b6d5-4e46-af3a-b55a796c4cdf,GRAVE,false,false,false,true,false,,,,,,,,"90a2fd7a-3ee5-4f00-b83d-e1ffb99c127d",2025-10-27 14:48:25.622 -0500,,,,,,true,true,"3d814797-f053-49c8-b49b-511c47e70094",,ERUPCIÓN CUTÁNEA,,ERUPCIÓN CUTÁNEA,,,ERUPCIÓN CUTÁNEA,,,ERUPCIÓN,,"ERUPCIONES, SARPULLIDOS Y EXANTEMAS NCOC",,ENFERMEDADES EPIDÉRMICAS Y DÉRMICAS,,,23,"10040785",TRASTORNOS DE LA PIEL Y DEL TEJIDO SUBCUTÁNEO,,2025-07-29 00:00:00.000,,"",Recuperando/resolviendo,EC-ARCSA-300070637,"90a2fd7a-3ee5-4f00-b83d-e1ffb99c127d"
